{
  "version": "0.1.0",
  "scope": {
    "uf": "SE",
    "level": "city",
    "cityId": "2802106",
    "name": "Estância"
  },
  "simulation": {
    "id": "estancia-business-base-001",
    "type": "business",
    "scenario": "estresse",
    "seed": "atlas-estancia-m3-2026-05-04",
    "generatedAt": "2026-05-04T06:38:52Z"
  },
  "inputs": {
    "facts": [
      {
        "id": "fact-estancia-population-2022",
        "text": "População residente de 65.078 habitantes em 2022.",
        "kind": "factual",
        "confidence": "alta",
        "sources": ["ibge-sidra-4714-estancia-pop-2022"]
      },
      {
        "id": "fact-estancia-gdp-2023",
        "text": "PIB corrente de R$ 1.473.225.000 em 2023.",
        "kind": "factual",
        "confidence": "alta",
        "sources": ["ibge-sidra-5938-estancia-pib-2002-2023"]
      },
      {
        "id": "fact-estancia-growth",
        "text": "Queda nominal do PIB de 38,19% entre 2022 e 2023.",
        "kind": "factual",
        "confidence": "alta",
        "sources": ["ibge-sidra-5938-estancia-pib-2002-2023"]
      }
    ],
    "assumptions": [
      {
        "id": "assumption-shock-case",
        "text": "Uma queda nominal forte deve ser tratada como caso de investigação e red team, não como conclusão automática de colapso.",
        "kind": "assumption",
        "confidence": "media",
        "sources": []
      }
    ],
    "events": []
  },
  "outputs": {
    "summary": "A simulação de negócio base trata Estância como caso de estresse. A queda nominal forte do PIB exige investigação setorial antes de recomendar ou descartar oportunidades. O valor público do pacote é mostrar que o Atlas sabe frear conclusões quando o dado agregado exige contexto.",
    "metrics": [
      {
        "id": "business_readiness",
        "label": "Prontidão para hipótese de negócio",
        "value": 38,
        "unit": "0-100",
        "kind": "simulation",
        "confidence": "media"
      },
      {
        "id": "shock_attention",
        "label": "Atenção a choque econômico",
        "value": 72,
        "unit": "0-100",
        "kind": "simulation",
        "confidence": "media"
      },
      {
        "id": "evidence_coverage",
        "label": "Cobertura inicial de evidência",
        "value": 31,
        "unit": "0-100",
        "kind": "simulation",
        "confidence": "media"
      }
    ],
    "recommendations": [
      {
        "id": "rec-estancia-sector-shock",
        "title": "Investigar composição setorial da queda",
        "rationale": "A queda nominal forte pode estar concentrada em setor específico e não deve virar diagnóstico social amplo sem decomposição.",
        "risk": "Descartar oportunidades locais por leitura agregada apressada.",
        "confidence": "alta"
      },
      {
        "id": "rec-estancia-litoral-axis",
        "title": "Adicionar dados de litoral, turismo, indústria e serviços",
        "rationale": "Estância amplia a matriz sergipana para o eixo leste/litoral.",
        "risk": "Sem esses dados, a comparação com polos do agreste fica incompleta.",
        "confidence": "media"
      }
    ]
  },
  "verifiers": [
    "fontes oficiais identificadas",
    "simulação marcada como simulação",
    "sem recomendação financeira direta",
    "sem dados privados"
  ],
  "disclaimer": "Esta é uma simulação sintética agregada de triagem territorial, não conselho financeiro, pesquisa de mercado conclusiva ou recomendação de investimento.",
  "limitations": [
    "Queda nominal precisa ser explicada por setor.",
    "Não há dados de emprego, renda, turismo, indústria, fluxo, concorrência ou custos nesta versão.",
    "As oportunidades citadas são hipóteses para investigação."
  ],
  "sources": [
    "ibge-sidra-4714-estancia-pop-2022",
    "ibge-sidra-5938-estancia-pib-2002-2023",
    "ibge-localidades-estancia"
  ]
}
